{
  "positive_int64": 5000000000000000000,
  "negative_int64": -5000000000000000000,
  "max_int64": 9223372036854775807,
  "min_int64": -9223372036854775808,
  "zero_int64": 0,
  "max_int64_minus1": 9223372036854775806,
  "min_int64_plus1": -9223372036854775807,
  "small_uint64": 42,
  "large_uint64": 10000000000000000000,
  "max_uint64": 18446744073709551615,
  "max_uint64_minus1": 18446744073709551614,
  "zero_uint64": 0,
  "one_int64": 1,
  "neg_one_int64": -1,
  "one_uint64": 1,
  "neg_two_int64": -2,
  "large_integer_64bit": 73014444032,
  "negative_large_integer_64bit": -73014444032,
  "large_unsigned_integer_64bit": 18446744073709551615,
  "bounded_integer_32bit": 2147483647
}
